{"schema_version":1,"package_id":"V3-QUALITY-01","owner":"quality-engineering","objective":"量化评测和工程质量门禁","inputs":["golden scenarios","evaluation datasets"],"outputs":["CI matrix","ablation report","load report"],"acceptance":["thresholds measured","security regression passes"],"test_profiles":["ci","load","fault","security"],"business_refs":["held-out human gate"],"development_refs":["OTLP optional"],"risk_refs":["fake指标替代真实指标"]}
