{"schema_version":1,"package_id":"V3-DEMO-01","owner":"product-engineering","objective":"一键复现演示与面试资产","inputs":["all V3 packages"],"outputs":["one-command demo","APK","architecture and interview docs"],"acceptance":["clean machine bootstrap","golden scenarios"],"test_profiles":["demo.e2e","clean.bootstrap"],"business_refs":["DEMO_FIXTURE"],"development_refs":["compose","android emulator"],"risk_refs":["发布结论越权"]}
