{"schema_version":1,"package_id":"V3-PLATFORM-01","owner":"platform-engineering","objective":"durable job与持久化运行链","inputs":["PostgreSQL","Qdrant","MinIO"],"outputs":["202 job","Worker","recoverable SSE"],"acceptance":["integration services pass","no duplicate terminal event"],"test_profiles":["postgres.integration","qdrant.integration","compose"],"business_refs":["demo_fixture_boundary"],"development_refs":["ports","durable_job"],"risk_refs":["重复领取","任务丢失"]}
