{"schema_version":1,"package_id":"V3-DECISION-WORKBENCH-01","owner":"android-ui","objective":"交付承接推荐结果栈的约束导向决策工作台","inputs":["selected recommendation ids","Mission constraints","comparison event","lists API","cart API"],"outputs":["confirmed decision screen","saved plan","wishlist state"],"acceptance":["Agent conclusion first","tradeoffs visible","unmet constraints visible","evidence reachable","API driven collections"],"test_profiles":["android.unit","android.instrumentation"],"business_refs":["budget 1000","commute noise cancellation","in-ear accepted","over-ear excluded","comparison evidence"],"development_refs":["preview 03","typed comparison payload","ThreadSnapshot"],"risk_refs":["隐藏不满足项","参数表退化","本地假状态","保存成功假反馈"]}
