{"schema_version":1,"package_id":"V3-OPS-OBSERVABILITY-01","owner":"ops-web","objective":"交付以 Mission Trace 为核心的真实 API 可观测运营台","inputs":["generated TypeScript client","trace API","retrieval metrics API","evaluation API","release gate API","PostgreSQL audit"],"outputs":["confirmed Ops dashboard","persistent conflict and evaluation workflows"],"acceptance":["no static runtime data","trace to evidence","measured cost only","refresh persists state","evidence gates separated"],"test_profiles":["web.unit","playwright","postgres.integration","contract-drift"],"business_refs":["DEMO_FIXTURE","release gates","human evaluation"],"development_refs":["preview 07","apps/ops-web","TanStack Query","Contract 0.2.0"],"risk_refs":["静态数据冒充运行态","DEMO与LIVE混报","Fake成本冒充实测","刷新丢审计","泄露思维链"]}
