{"schema_version":1,"package_id":"V3-MISSION-WORKBENCH-01","owner":"android-ui","objective":"交付对话后全屏纵向推荐结果栈","inputs":["analysis-completed thread snapshot","ordered products/offers/comparison","selected art direction"],"outputs":["confirmed result preview","three-page vertical recommendation pager"],"acceptance":["user confirmed","API-driven ranking","primary-secondary-tertiary snap navigation"],"test_profiles":["android.unit","android.instrumentation","process.recovery"],"business_refs":["DEMO_FIXTURE products","grounded comparison"],"development_refs":["preview 01 v3","apps/android"],"risk_refs":["手势方向歧义","多层滚动冲突","模型排序冒充商业事实"]}
