{"schema_version":1,"package_id":"V3-INTELLIGENCE-CONTROL-01","owner":"agent-product","objective":"控制可解释Agent决策体验","inputs":["typed events","ten tools","hybrid retrieval"],"outputs":["confirmed progress and approval flows"],"acceptance":["no chain of thought","facts grounded"],"test_profiles":["agent.unit","provider.contract","retrieval.golden"],"business_refs":["evidence grade"],"development_refs":["agent runtime"],"risk_refs":["模型编造商业事实","绕过授权写操作"]}
