{"schema_version":1,"package_id":"V3-OPS-01","owner":"frontend-platform","objective":"真实API驱动运营台","inputs":["Ops API","generated types"],"outputs":["TanStack Query console","persistent audit"],"acceptance":["web build passes","five Playwright flows"],"test_profiles":["web.unit","web.playwright","postgres.integration"],"business_refs":["evidence boundaries"],"development_refs":["development headers"],"risk_refs":["静态状态冒充持久化"]}
