{"schema_version":1,"package_id":"V3-AGENT-PROGRESS-01","owner":"agent-ux","objective":"交付推荐结果前的连续对话、必要澄清和公开分析体验","inputs":["turn messages","mission_updated","progress events","terminal state"],"outputs":["confirmed conversation and public-analysis UI","result-stack navigation contract"],"acceptance":["clarification updates Mission","no chain of thought","event aligned","no product before completion","completion routes to V3-MISSION-WORKBENCH-01"],"test_profiles":["agent.reducer","android.instrumentation"],"business_refs":["budget","commute noise cancellation","exclude over-ear","in-ear acceptance"],"development_refs":["preview 02","typed progress event","ThreadSnapshot"],"risk_refs":["进度伪造","内部推理泄露","提前展示推荐","澄清回答未持久化"]}
