{"schema_version":1,"package_id":"V3-PRODUCT-CONTROL-01","owner":"product-control","objective":"冻结V3产品结果与三层控制规则","inputs":["V3 baseline","existing V3 packages"],"outputs":["control index","roll-up gates","confirmation sequence"],"acceptance":["hierarchy validates","one active confirmation"],"test_profiles":["task_packages.validation"],"business_refs":["RAG shopping Agent outcome"],"development_refs":["control-index.json"],"risk_refs":["控制包完成不等于发布完成"]}
