{"schema_version":1,"package_id":"V3-ACTION-APPROVAL-01","owner":"agent-security-ux","objective":"交付可审计、可取消且幂等的安全行动确认闭环","inputs":["pending action","approval API","offer grade","offer timestamp","link resolver","idempotency key"],"outputs":["confirmed approval sheet","approval audit record","fresh offer evidence","safe redirect intent"],"acceptance":["explicit confirmation","no side effect before approval","new evidence timestamp","safe redirect","idempotent replay"],"test_profiles":["approval.integration","idempotency","android.instrumentation","safe-link"],"business_refs":["AeroDot N7","DEMO_FIXTURE","LIVE_AUTHORIZED","demo merchant"],"development_refs":["preview 04","pending approval action","resolved HTTPS domain"],"risk_refs":["越权写操作","不安全深链","DEMO伪装LIVE","重复执行","取消后残留副作用"]}
