{"schema_version":1,"package_id":"V3-QUALITY-CONTROL-01","owner":"quality-product","objective":"控制竞赛演示和证据等级","inputs":["golden scenarios","evaluation reports","demo script"],"outputs":["confirmed demo storyboard","evidence map"],"acceptance":["no unsupported claim"],"test_profiles":["quality.gates","android.golden","human.review"],"business_refs":["commercial fact precision"],"development_refs":["CI","demo assets"],"risk_refs":["目标值冒充实测值"]}
