{"schema_version":1,"package_id":"V3-DATA-RAG-01","owner":"retrieval-engineering","objective":"项目自有演示数据与混合检索","inputs":["data/demo/catalog.v3.jsonl"],"outputs":["60 SKU","HybridSemanticIndex"],"acceptance":["catalog check passes","hybrid retrieval tests pass"],"test_profiles":["retrieval.unit","qdrant.integration"],"business_refs":["project_authored_demo_only"],"development_refs":["embedding_provider"],"risk_refs":["实体分裂","prompt injection"]}
