{"schema_version":1,"package_id":"V3-EXPERIENCE-CONTROL-01","owner":"android-product","objective":"控制任务决策我的三入口体验","inputs":["V3 Android implementation","Material 3 tokens"],"outputs":["three confirmed UI slices"],"acceptance":["all experience children confirmed"],"test_profiles":["android.unit","android.instrumentation"],"business_refs":["shopping mission"],"development_refs":["apps/android"],"risk_refs":["退化为传统商城"]}
