{"schema_version":1,"package_id":"V3-ANDROID-01","owner":"android-engineering","objective":"三入口Agent-first原生APP","inputs":["contract 0.2.0","typed SSE"],"outputs":["task screen","decision workspace","profile"],"acceptance":["unit passes","8 of 10 emulator scenarios"],"test_profiles":["android.unit","android.instrumentation","benchmark"],"business_refs":["DEMO_FIXTURE"],"development_refs":["10.0.2.2"],"risk_refs":["界面注入假E2E","不安全外跳"]}
