{"schema_version":1,"package_id":"V3-CONTRACT-01","owner":"api-platform","objective":"交付0.2.0类型化公共契约","inputs":["packages/contracts/openapi.json"],"outputs":["Python Kotlin TypeScript生成类型"],"acceptance":["contract generation check passes","typed SSE events pass"],"test_profiles":["api.unit","contract.drift"],"business_refs":["commercial_facts"],"development_refs":["openapi_0.2.0"],"risk_refs":["契约漂移"]}
